Job Title,Description,District,Work Mode
Analista Programador Full Stack,"En UTEC - Universidad de Ingeniería y Tecnología nos encontramos en búsqueda de un Analista Programador Full Stack ¿Cuáles serán tus retos? Trabajar en conjunto con equipos multidisciplinarios para garantizar la coherencia tecnológica y funcional de los proyectos. Análisis y diseño de soluciones Mantenimiento a aplicaciones inhouse Creación y mantenimiento de modelo de datos Pruebas unitarias y funcionales ¿Qué buscamos? Experiencia en desarrollo con Java (Spring Boot), React y/o Angular. Conocimiento en Arquitecturas de integración. Experiencia en interacción con algún CRM y/o ERP (implementación, integración, soporte o personalización). Manejo de bases de datos relacionales (Oracle, MySQL, PostgreSQL, etc.). Conocimientos en metodologías ágiles (Scrum, Kanban). Experiencia trabajando baj",Barranco,Remoto
Desarrollador .Net / PHP,"More digital. More human. More Minsait. En Minsait, una compañía de Indra, somos líderes globales en tecnología y consultoría digital. Conectamos personas, tecnología y negocios para impulsar el crecimiento, la transformación y un impacto positivo y sostenible. ¡Únete como Desarrollador .NET/PHP! Buscamos profesionales apasionados por la tecnología, con ganas de formar parte de nuestros equipos multidisciplinares y contribuir a proyectos de alto impacto. ¿Qué buscamos? Profesional de Ingeniería de Sistemas, Informática o carreras afines. Mínimo 4 años de experiencia desarrollando con .NET y PHP. Conocimientos sólidos en:C# .NET ASP 3 JavaScript, VB 6.0 SQL Server GIT (control de versiones) PHP Nativo 5.6 MySQL Valoramos adicionalmente: Experiencia en migraciones de PHP 5.6 a 8.4 Manejo de ",Lima,Remoto
Desarrollador Python Odoo,"🚀 Desarrollador Python Odoo Modalidad: Presencial Horario: Lunes a Viernes (9:00 am – 6:00 pm) 🎓 Requisitos académicos Bachiller o título universitario en Ingeniería de Software, Ciencias de la Computación, Sistemas o afines. Deseable: certificaciones en Odoo, Python o Cloud. 💻 Conocimientos indispensables Python avanzado para Odoo (ORM, herencia de modelos, decoradores, contextos). Framework Odoo (módulos, vistas XML, QWeb, seguridad). PostgreSQL (optimización y gestión). APIs REST/XML-RPC, integraciones externas. Git y metodologías ágiles (Scrum/Kanban). Frontend básico: XML y JavaScript para personalización de vistas. ⭐ Conocimientos deseables Librerías de Data Science (Pandas, NumPy). Frameworks backend: FastAPI, Flask. Bases de datos NoSQL (MongoDB). CI/CD y DevOps (Docker, Kubernetes",Lima,Presencial
Desarrollador FullSatck - Enfoque en Frontend,"En FRACTAL, consultora TI peruana con más de 10 años de experiencia en el mercado nacional e internacional, nos encontramos en búsqueda de un(a) Desarrollador Fullstack con experiencia en CMS para colaborar en modalidad híbrida en un proyecto con uno de nuestros clientes nacionales. Requisitos Frontend: Formación universitaria culminada en Ingeniería de Sistemas, Software, Computación e Informática o carreras afines. 2 a 3 años de experiencia en el puesto y desarrollando con JavaScript y TypeScript. Experiencia en desarrollo de interfaces con React Manejo de estado y asincronía (Zustand, React Query, Axios) Creación de UI responsiva y accesible (Tailwind, Radix) Validación de datos y formulatrio /React Hook Form, Zod) Visualización de datos (gráficos, fechas, Excel) Optimización y buenas p",Lima,Híbrido
Practicante de Digitalización,"¡Hola a todos! En REPSOL, estamos buscando entusiastas e innovadores Practicantes de Digitalización para unirse a nuestro equipo. ¡Únete a nosotros y ayuda a dar forma al futuro de la energía! REQUISITOS Estudiante de últimos ciclos de las carreras de Ing. Sistemas, Ing. Industrial o afines Manejo de herramientas de automatización y/o programación Power BI a nivel intermedio. Paquete de office a nivel intermedio. Idioma de ingles a nivel intermedio. FUNCIONES Apoyo en el levantamiento de procesos y elaboración de flujogramas de la operación. Identificación de oportunidades de eficiencia y automatización, así como la optimización de proyectos en ejecución. Participación en la elaboración de aplicativos que permitan la digitalización y diminuyan la manualidad del negocio Apoyo en la actualiz",San Isidro,Presencial
ANALISTA PROGRAMADOR Java - Microservicios,"Somos Canvia ¡Una empresa que innova y reinventa! ¡Buscamos a un Programador Java con ADN de innovación! Top de razones para trabajar con nosotros: CANVIA es una de las empresas más grandes del sector IT en el Perú y nuestro propósito es hacer más fácil la vida de las personas, innovando e implementando proyectos de transformación digital en múltiples industrias. Nos mueve la reinvención, hacer las cosas diferentes a través de buenas ideas, cuestionar el statu quo. Años de experiencia desarrollando y ejecutando soluciones con un equipo humano valioso y que suma diferentes capacidades, nuevos modelos de negocios a través del uso de tecnologías digitales y sistemas de gestión del cambio soportados en una cultura Lean-Agile. ¿Qué retos tendrás como Programador? Desarrollo de sistemas y/o soft",Cercado De Lima,Híbrido
Programador,"¿Cuáles serán mis desafíos? Planificar y programar las operaciones de transporte y abastecimiento de productos a nivel nacional. Coordinar la disponibilidad operativa de las unidades en función de la demanda de los clientes y la capacidad de atención. Asegurar la continuidad del suministro de productos en distintas regiones del país, priorizando las zonas críticas para garantizar la cobertura oportuna. Gestionar la programación bajo criterios de seguridad y eficiencia, manteniendo una comunicación fluida entre las áreas involucradas en la operación. Velar por el cumplimiento de los estándares de servicio y la optimización de recursos en las operaciones logísticas. ¿Qué es lo que se requiere de mí? Estudios Universitarios y/o Técnicos de Ingeniería Industrial, Cadena de Suministro, Transpor",Lima,Presencial
Analista Programador FRONTEND - Angular,"Somos Canvia, formamos parte del portafolio de Advent International y contamos con 34 años de presencia en el mercado local. Nuestro propósito es hacer más fácil la vida de las personas, innovando e implementando proyectos de transformación digital de nuestros clientes de manera ágil y segura. ¡Reinventa el futuro con Canvia! Si sientes pasión por la tecnología y quieres transformar negocios, esta es tu oportunidad para desarrollarte en una empresa inclusiva, diversa, que se desafía constantemente. Nuestro propósito es hacer más fácil la vida de las personas, innovando e implementando proyectos de transformación digital con un metodología ágil y segura. Como Analista Programador ANGULAR tendrás la misión de: Desarrollar la interfaz de usuario en Angular con Microfrontends. Integrar con Azu",Lima,Híbrido
Practicante Profesional: Programación PLSQL,"¿Estás buscando iniciar tu carrera como Practicante Profesional Desarrollador PL/SQL en un proyecto retador y con gran proyección de crecimiento? ¡Esta es tu oportunidad! 🙌 Requisitos clave: Recien egresados de Sistemas, computación o afines. Conocimientos en PL/SQL y Oracle. Experiencia previa en proyectos académicos o prácticas relacionadas. Conocimientos básicos en Java (Spring) [deseable]. Conocimientos básicos en AngularJS [deseable]. Interés en aprender y aportar en procesos de migración tecnológica. Actitud proactiva, orientación a resultados y capacidad para trabajar en equipo. ✨ Beneficios: Home office ergonómico. Plan de desarrollo profesional. Subvención económica inicial S/1400 Incrementos salariales según desempeño Seguro FOLA Línea de carrera Capacitación constante 📍 Modalida",San Isidro,Remoto
Tech Lead / Líder Técnico Frontend (React + NextJS),"ZUTUN. es una empresa de software boutique con amplia experiencia en banca, seguros, fintech y retail. Nuestro colectivo funciona como un verdadero equipo, valorando la colaboración, la sinergia y el apoyo mutuo entre nuestros miembros, reconociendo que el talento es el núcleo y el equipo es quien juega el partido. Te invitamos a participar de proceso TECH LEAD / LIDER TÉCNICO FRONTEND (REACT + NEXTJS) y ser parte de esta experiencia: RESPONSABILIDADES: Liderar el diseño e implementación de arquitecturas web y/o móviles. Coordinar tareas de desarrollo frontend en su mayoría. Desarrollar e integrar APIs, servicios externos y sistemas de terceros. Supervisar buenas prácticas de testing automatizado y control de versiones. Gestionar la infraestructura, rendimiento y disponibilidad de los sist",Lima,Híbrido
Practicante Profesional Desarrollador PL/SQL,"¿Estás buscando iniciar tu carrera como Practicante Profesional Desarrollador PL/SQL en un proyecto retador y con gran proyección de crecimiento? ¡Esta es tu oportunidad! 🙌 Requisitos clave: Egresados de Ing. de Sistemas o afines. Conocimientos en PL/SQL y Oracle. Experiencia previa en proyectos académicos o prácticas relacionadas. Conocimientos básicos en Java (Spring) [deseable]. Conocimientos básicos en AngularJS [deseable]. Interés en aprender y aportar en procesos de migración tecnológica. Actitud proactiva, orientación a resultados y capacidad para trabajar en equipo. ✨ Beneficios: Home office ergonómico. Plan de desarrollo profesional. 📍 Modalidad: Remoto total. 🕐 Horario: L-V 9:00 a.m. – 6:30 p.m. 🔗 ¿Te interesa? Envía tu CV a esta publicación.",Lima,Remoto
Analista Programador Visual Basic .Net,Analista Programador Visual Basic .Net Resumen del Puesto Estamos buscando un Analista Programador Visual Basic .Net con experiencia en desarrollo y mantenimiento de aplicaciones en Visual Basic .Net. El candidato ideal tendrá la oportunidad de participar en proyectos desafiantes dentro de un entorno dinámico. Responsabilidades Desarrollo y mantenimiento de aplicaciones en Visual Basic .Net. Participación en el diseño y la implementación de soluciones de software. Colaboración con otros miembros del equipo para garantizar la calidad del código. Optimización de código y resolución de incidencias. Requisitos Experiencia en desarrollo y mantenimiento de aplicaciones en Visual Basic .Net. Manejo de C#. Experiencia en Stored Procedures en SQL. Experiencia en procesos de ETL utilizando SQL Serve,Barranco,Presencial
Desarrollador Java Mobile,"Fundado en París en 1895 y con más de 100 años de experiencia en la enseñanza de las artes culinarias y hospitalidad, en la actualidad Le Cordon Bleu tiene 40 escuelas en más de 20 países, con un promedio de 30 millones de alumnos en todo el mundo con más de 70 de nacionalidades lo que hace de Le Cordon Bleu tu pasaporte al mundo. En Perú La Red Educativa Le Cordon Bleu está conformado por 2 unidades de negocio principales, la Universidad Le Cordon Bleu con 4 carreras orientadas a la gestión, técnicas alimentarias y el turismo. El Instituto Le Cordon Bleu con 5 carreras profesionales enfocadas en servicio de la gastronomía, hotelería y bar. Le Cordon Bleu Perú los invita a ser parte de este mundo de experiencias y creatividad. Le Cordon Bleu, la Red Educativa líder en formar profesionales ",Lima,Presencial
Desarrollador Full Stack,"¡Hola talentos! Somos un holding empresarial destacado en el sector salud en Perú, ofrecemos servicios médicos de excelencia con soluciones innovadoras y tecnología avanzada. Con una amplia red de centros médicos y una sólida presencia en el mercado, nos destacamos por nuestra inclusión y mejora continua. ¡Forma parte de nuestro gran equipo y transforma el cuidado de la salud en el país como Desarrollador Full Stack! Requisitos: Egresados de la carrera de Ing. De Sistemas, Informática y/o afines. Experiencia en lenguajes de programación Python, Angular ( 1 0 o superior), Java, Conocimiento de Ajax, JSON y el modelo API REST (Deseable) Conocimiento de Operaciones Cloud: AWS (Deseable) Conocimientos en modelamiento y administración de base de datos (MySql, Mariadb, Postgres): Implementación ",Miraflores,Presencial
Programador de Inteligencia Artificial,"Analista de Desarrollo de Inteligencia Artificial Resumen Estamos buscando un Analista de Desarrollo de Inteligencia Artificial para unirse a nuestro equipo. El objetivo principal de la posición es el desarrollo de soluciones basadas en Inteligencia Artificial, el diseño y la ejecución de automatizaciones e integraciones mediante el consumo de APIs REST, Webhooks y estructuras JSON. Además, se espera la construcción de herramientas internas que permitan escalar procesos y optimizar la eficiencia operativa. Modalidad Remota. Responsabilidades Desarrollar soluciones basadas en Inteligencia Artificial Diseñar y ejecutar automatizaciones e integraciones mediante el consumo de APIs REST, Webhooks y estructuras JSON Construir herramientas internas para escalar procesos y mejorar la eficiencia op",Lima,Presencial
Desarrollador de Sistemas,"En Intelitech Perú, buscamos profesionales apasionados por la tecnología, con experiencia en desarrollo de software y ganas de trabajar en proyectos desafiantes. ✅ Requisitos principales: 📌 Experiencia de 3 a 5 añosen: Desarrollo de aplicaciones o Programación de software o Soluciones de software o Implementación de proyectos TI. 📌 Formación: Bachiller o Título Técnico en: Ingeniería de Sistemas y/o Software y/o Computación e Informática. 📌 Capacitación: En alguno de los siguientes cursos (no indispensable): -Metodologías Ágiles y/o Scrum -Java -Spring Framework -Angular 📍 Modalidad: Híbrida 💼 Forma parte de una empresa experta en TI y lleva tu carrera al siguiente nivel.",Lima,Presencial
Desarrollador Full Stack,"Desarrollador Full Stack Resumen Buscamos un Desarrollador Full Stack con experiencia en el desarrollo de aplicaciones web. El candidato ideal tendrá un sólido conocimiento de lenguajes de programación como PHP, Python, JavaScript, Java, y experiencia con frameworks como Laravel y Además, deberá tener experiencia en el diseño y desarrollo de APIs RESTful y en el manejo de bases de datos como MySQL o PostgreSQL. Responsabilidades Desarrollar y mantener aplicaciones web utilizando las tecnologías mencionadas. Diseñar e implementar APIs RESTful para la comunicación entre el frontend y el backend. Trabajar en estrecha colaboración con otros desarrolladores y equipos para entregar productos de alta calidad. Participar en el diseño de la arquitectura de las aplicaciones. Realizar pruebas unitari",Antioquia,Presencial
Analista programador Fullstack,"Requisitos - Conocimientos en desarrollo de soluciones con , / Angular - Conocimientos en diseño, consultas y programación en bases de datos (MySQL, PostgreSQL). - Conocimientos en desarrollo en Python - Experiencia en documentación funcional / técnica de sistemas. - Mantenimiento de versiones del software - Asegurar que el código sea en adecuado por medio de las pruebas unitarias. - Participar activamente con los usuarios y pares en la solución de iniciativas.",San Isidro,Presencial
