Job Title,Description,District,Work Mode
Mid Node AWS Engineer,"Información Importante Ubicación: Perú Modalidad de trabajo: Híbrido, asistencia a oficina en Miraflores 2-3 veces por semana Resumen del puesto Como un Mid Node AWS Developer (17274), formarás parte de un equipo tecnológico y ágil altamente calificado por respaldar y desarrollar soluciones de vanguardia para cumplir con los requisitos de nuestro negocio. Nos ayudará a acelerar los resultados empresariales de nuestros clientes mediante la innovación de productos digitales de vanguardia. Requisitos y Habilidades Profesionales de Sistemas, Informática, Desarrollo o afines con +4 años de experiencia como Node Developer. Experiencia trabajando en/con: Desarrollo Servicios Core AWS (EC2, S3, IAM, VPC, Cloudwatch, etc) Desarrollo Servicios AWS Serverless: Dynamo DB, Lambda, API Gateway, RDS, SQS",Miraflores,Híbrido
Analista de Programación RPG,"¡Somos Izipay! La red multimarca más grande del país, ¡estamos revolucionando el mercado de pagos! Con la meta de hacer crecer por x4 nuestro número de comercios atendidos, necesitamos reforzar nuestro equipo con personas como tú. ¡Ven a sumarte a este desafío como Analista de Programación ¿Cuáles serán tus responsabilidades? Diseñar, programar, probar e implementar soluciones que optimicen los procesos del área. Diagnosticar y corregir problemas en los sistemas existentes. Identificar oportunidades de mejora en las aplicaciones y procesos actuales. Generar y actualizar manuales, guías y diagramas de las soluciones implementadas. Colaborar con equipos multidisciplinarios. Requisitos: ¿Cómo saber que este puesto es para ti? Universitario egresado de Ingeniero de Sistemas y carreras afines. ",Miraflores,Híbrido
Desarrollador Backend,"More digital. More human. More Minsait. Somos una empresa líder global de tecnología y consultoría digital que conecta personas, tecnología y negocios para generar crecimiento, transformación e impacto positivo y sostenible. Buscamos Desarrollador Backend Pleno con ganas de trabajar en nuestros equipos multidisciplinares. ¿Cuál es el reto que te proponemos? Estarás en contacto continuo con las novedades tecnológicas, impulsando la transformación digital. Participarás en proyectos y desarrollos que tienen una alta visibilidad y que marcan la diferencia con soluciones disruptivas y especializadas para toda la cadena de valor. ¿Qué esperamos por tu parte? Formación Académica: Bachiller en Ingeniería de sistemas o afines Experiencia: Conocimiento Técnico: Java 11 (Medio) Experiencia en Spring ",Lima,Remoto
"Programador RPA Rocketbot, UiPath","En Valtx, empresa con 24 años de experiencia en el mercado peruano, cuyo objetivo principal es convertirse en un socio estratégico, mediante soluciones tecnológicas en los diversos aspectos de los procesos de negocios; el desarrollo, implementación y mantenimiento de aplicaciones e infraestructura tecnológica para el negocio; y consultoría en diversos procesos de transformación, nos encontramos en la búsqueda de un Programador RPA Analizar y documentar procesos de negocio para identificar oportunidades de automatización en coordinación con las áreas usuarias. Diseñar soluciones de automatización en plataformas Rocketbot y UiPath, aplicando estándares de calidad y marcos de trabajo como REFramework. Desarrollar, probar e implementar bots que sean estables, escalables y seguros, garantizando",San Borja,Presencial
Soporte Jr y Sr de Plataforma BMC Helix Remedy,"Somos una empresa de Soluciones Digitales y Servicios de TI con 30 años de experiencia en el mercado. Contamos con más de 8 mil colaboradores en Latinoamérica, Estados Unidos y Europa. Te invitamos a ser parte de nuestro equipo ocupando el cargo de: Analista de Soporte Requisitos indispensables: Experiencia en soporte y seguimiento de incidentes y problemas Conocimiento en BMC Helix y herramientas relacionadas Capacidad para colaborar en la resolución y escalado de casos Beneficios: Pertenecer al grupo América Móvil. Sueldo en planilla 100% desde el primer día. EPS corporativa (opcional). Convenios corporativos. “Global Hitss mantiene una política de contratación inclusiva, por lo que invita a cualquier persona a participar en el proceso de selección en referencia”. ¡Te invitamos a revisar",La Victoria,Presencial
Desarrollador Backend,"Actualmente nos encontramos en búsqueda de 01 Desarrollado Backend para que se integre a nuestro equipo. Profesional en Ingeniería de Sistemas, Computación, Informática o carreras afines. Experiencia mínima de 4 a 5 años en desarrollo con Python, Node.js .Net Lenguajes: Python (3.x) , JavaScript/TypeScript (Node.js LTS) y C# .Net Frameworks: FastAPI o Flask; Express/NestJS. AWS: S3, Lambda, API Gateway/ALB, Step Functions o EventBridge, CloudWatch, IAM; deseable ECS/Fargate o AWS Batch. Datos: Formato Parquet (particionamiento, compresión), DynamoDB (modelado single-table, GSIs, TTL), MongoDB (pipelines de agregación, índices compuestos), Elasticsearch (index templates, mappings, queries, bulk ingestion). Mensajería/eventos: SQS/SNS o Kafka (básico). Testing & calidad: PyTest/Jest, linters",El Agustino,Presencial
Desarrollador Fullstack Java,"¡En Hitss, empresa de tecnología con más de 36 años de experiencia ofreciendo soluciones innovadoras en América Latina, USA y EUROPA, nos encontramos en la búsqueda de nuestro próximo ANALISTA PROGRAMADOR JAVA/ANGULAR! REQUISITOS: Bachiller o titulado de Ingeniería de Sistemas, Informática, o carreras afines. SKILSS TÉCNICOS: Experiencia de 3+ años en Java 7 o superior usando frameworks Angular versión 8 o superior (intermedio/avanzado). Spring (intermedio/avanzado), Hibernate (Intermedio),Primefaces (Intermedio). Experiencia en entorno Azure (Servicios en la nube y despliegue). Desarrollo de Webservices REST y SOAP (intermedio). Microservicios (Spring webflux que va de la mano con microservicios). Experiencia en Oracle PLSQL (intermedio). Inglès a nivel intermedio (B1 como mínimo).",La Victoria,Remoto
Programador ABAP / Preencial,"En Experis Perú buscamos al mejor talento para sumarse a los desafíos de la era digital y llevar su carrera a un siguiente nivel. Por ello, te invitamos a que formes parte del reto como Programador ABAP para el sector de consumo masivo para la ciudad del Callao. Requisitos: Profesional de ingeniería de sistemas o afines. Experiencia de 3 años con: Programación ABAP Experiencia con SAP ERP y/o SAP Hana Certificado en ABAP o BTP Funciones Desarrollar y mantener aplicaciones ABAP en el entorno SAP, implementando integraciones entre sistemas SAP y aplicaciones externas. Optimizar el rendimiento y la escalabilidad de soluciones ABAP, así como crear aplicaciones personalizadas y extensiones en SAP Proporcionar soporte técnico y mantenimiento de soluciones ABAP, elaborando la documentación técnic",Callao,Presencial
Desarrollador Fullstack (Java/Js) - Remoto,"Protiviti Perú se encuentra en la búsqueda de un Desarrollador Fullstack especializado en microservicios para un cliente del sector retail farmacéutico. Responsabilidades clave: Desarrollar aplicaciones basadas en microservicios utilizando Java (Hibernate y Spring Boot) y Angular. Implementar soluciones siguiendo arquitectura hexagonal para garantizar modularidad y mantenibilidad. Diseñar, desarrollar y consumir APIs RESTful/APIs REST JSON para integrar los microservicios. Trabajar con bases de datos Oracle, MySQL y SQL, optimizando consultas y rendimiento. Colaborar con equipos de QA y DevOps para automatizar pruebas, despliegues y monitoreo de aplicaciones. Realizar revisiones de código y asegurar la calidad y eficiencia de los servicios. Documentar componentes y servicios desarrollados.",Lima,Remoto
Analista Programador,"REQUISITOS: ü Profesional bachiller o egresado de Ingeniería de sistema,Informática ü con amplio compromiso responsabilidad ü Edad 26 - 40 años EXPERIENCIA LABORAL: ü Contar con 3 años como mínimo Analista Programador de sistemas informáticos en .NET y JAVA (desarrollador) ü Experiencia en desarrollo Front End con sólidas habilidades en JavaScript, ü Haber laborado en empresas de rubro industriales y Servicios Hospitalarios.( clínicas , MINSA), ü Conocimientos Funcional de ERP : SAP , Spring. ü Conocimiento de Innovación tecnológica servicios médicos. FUNCIONES: ü Desarrollar y realizar mantenimiento a los Sistemas de la organización corporativa ü Manejo de BD SQL, ( Intermedio/ Avanzado) ü Realizar mejoras y ser participe en los proyectos del cambio del ERP ü Crear, dar mantenimiento y ac",Lima,Presencial
Backend Java - Sector bancario,"En Experis Perú buscamos al mejor talento para sumarse a los desafíos de la era digital y llevar su carrera a un siguiente nivel. Por ello, te invitamos a que formes parte del reto como BACKEND JAVA en el rubro Bancario: BACKEND JAVA Requisitos para postular al cargo: Profesional de las carreras de Ingeniería de sistemas, informática o afines. Experiencia mayor a 5 años en Java y Spring Boot Experiencia mayor a 4 años en Oracle, MySQL y PostgreSQL Experiencia en programación reactiva Experiencia en SOLID Funciones principales del puesto: Implementa y mantiene la funcionalidad del servidor que da soporte a la aplicación. Crea y administra bases de datos para almacenar y gestionar la información de manera eficiente. Desarrolla y mantiene APIs (interfaces de programación de aplicaciones) para",Lima,Híbrido
Desarrollador Frontend React - Por Proyecto,"En Indra seguimos creciendo y buscamos Desarroladores Frontend React.js para formar parte de nuestro equipo. Si eres un apasionado de la tecnología, tienes experiencia en plataformas de datos y quieres formar parte de una empresa global en constante innovación, ¡este es tu lugar! 🎯 Requisitos técnicos: Profesional universitario o técnico de Ingeniería de Sistemas, Informática o carreras afines. Experiencia de 3 años a más con React Js (indispensable). Experiencia en preprocesadores CSS. Experiencia en integraciones de APIS (AMPLIFY). Experiencia en patrones de arquitectura (Ej, MVC, Flux, etc). Experiencia en microfrontend. Experiencia con Javascript (one-page lifecycle, anonymous functions, scoping, polifylling). Experiencia con UX/UI (deseable) Beneficios: 🚑 EPS 100% 📚 Acceso total a Ude",San Isidro,Híbrido
Desarrollador Full Stack Senior – Ecommerce (Magento),"Buscamos un Desarrollador Full Stack Senior con experiencia en Magento que garantice la operación, evolución y optimización de nuestro ecommerce. Será un socio técnico clave entre el equipo interno y la agencia, responsable de implementar y ajustar soluciones que aseguren un portal ágil, seguro y confiable, fortaleciendo la experiencia de compra y la presencia online de nuestras marcas. Funciones: Monitorear y garantizar el funcionamiento continuo del portal, previniendo caídas a partir del seguimiento de métricas claves de performance. Atender y dar solución directa a problemas reportados por el equipo ecommerce. Priorizar resolución de problemas técnicos y nuevos desarrollos de mejora en función al valor que agreguen al negocio. Implementar modificaciones, personalizaciones y mejoras en ",Magdalena del Mar,Híbrido
Desarrollador Genexus,"SOFTWARE ENTERPRISE SERVICES Somos una empresa peruana de Tecnologías de la Información y Comunicaciones, que cuenta con amplia experiencia en la prestación de servicios informáticos mediante Outsourcing TI y Fábrica de Software, para clientes nacionales e internacionales, asegurando la calidad de servicio con sólidos procesos estandarizados en un sistema integrado de gestión. Nos encontramos en la búsqueda del mejor talento para ocupar la siguiente posición: DESARROLLADOR GENEXUS Requisitos: Universitario Egresado, Titulado, Bachiller o Técnico Egresado, Titulado Carreras de Ingeniería de Sistemas, de Software, Informática, Computación o afines Experiencia de 3 a 5 años mínimo de experiencia Genexus , Bantotal y SQL Herramientas no técnicas: Trabajo en equipo Comunicación Eficaz Benefici",Cercado De Lima,Híbrido
Analista Senior de Automatizaciones e Inteligencia Artificial - Hibrido,"En Cibergestión Perú, empresa de servicios BPO presente en 7 países y con atención a las principales entidades financieras, se encuentra en la búsqueda del mejor talento 💪 para ocupar el puesto de Analista Senior de Automatizaciones e Inteligencia Artificial Misión: Diseñar, desarrollar y mantener soluciones de automatización e inteligencia artificial que mejoren la eficiencia de los procesos internos y productos de software, contribuyendo a la innovación tecnológica de la organización. Algunas funciones: Liderar un pequeño equipo de analistas. Gestionar los procesos de operaciones diarias. Identificar oportunidades de automatización en procesos internos y/o clientes. Colaborar con equipos de desarrollo, QA, producto y negocio.miento del servicio que la empresa disponga. Diseñar y desarrol",San Isidro,Híbrido
ANALISTA PROGRAMADOR VB6,"Somos Real Systems, tenemos 30 años de experiencia en el negocio de software empresarial y consultoría. Hemos implementado exitosamente soluciones en empresas de todos los sectores y giros de negocio. Contamos con un sistema de gestión de calidad basado en ISO 9001. Ofrecemos las soluciones de software para empresas, de acuerdo a la normativa y realidad nacional, con visión global. Nos encontramos en búsqueda de un ANALISTA PROGRAMADOR VB6. MISIÓN DEL PUESTO: Diseñar, codificar y mejorar los modelos de software que satisfagan las necesidades de la empresa y los clientes. REQUISITOS: Técnico Titulado - Bachiller Universitario de Ing. de Sistemas, Ing. Software o afines. DOMINIO LENGUAJES DE PROGRAMACIÓN (3 AÑOS MINIMO) VB6, .NET. EXPERIENCIA EN SOFTWARES CONTABILIDAD, PLANILLAS, ACTIVOS FIJ",San Isidro,Presencial
Desarrollador Backend,"En Experis Perú buscamos al mejor talento para sumarse a los desafíos de la era digital y llevar su carrera a un siguiente nivel. Por ello, te invitamos a que formes parte del reto como Analista de Software de Integración y Soluciones Digitales para una importante empresa del sector. Funciones: Desarrollar, implementar y dar soporte a las aplicaciones o sistemas asignados a su cargo. Contribuir con la labor de soporte de terceros proveedores de sistemas a cargo del área. Contribuir con el equipo de Calidad en la preparación de los scripts y pruebas unitarias de los productos desarrollados antes de su pase a certificación. Coordinar con las áreas correspondientes las pruebas, certificaciones y puesta en producción de los programas y aplicativos a su cargo. Garantizar la integridad y confide",Miraflores,Híbrido
Desarrollador full stack .Net,"Buscamos un(a) Desarrollador(a) Full-Stack con experiencia en tecnologías modernas de desarrollo Front-End y Back-End. La persona ideal será capaz de analizar requerimientos, estimar esfuerzos, desarrollar soluciones escalables y mantener sistemas robustos en arquitecturas de microservicios y APIs Restful. Ubicación:Lima Modalidad: Tiempo completo 🔹 Requisitos: 4 años de experiencia como programador o desarrollador de software. Dominio avanzado de: .Net Nivel intermedio en: Java GitLab Docker Nivel intermedio/avanzado en PostgreSQL. 🔹 Responsabilidades: Diseñar, desarrollar y optimizar aplicaciones de alto rendimiento. Colaborar con equipos multidisciplinarios para la integración de sistemas. Mantener buenas prácticas de programación, control de versiones y documentación. Proponer mejoras ",Lima,Presencial
Desarrollador FrontEnd Senior,"Somos Canvia, formamos parte del portafolio de Advent International y contamos con 34 años de presencia en el mercado local. Nuestro propósito es hacer más fácil la vida de las personas, innovando e implementando proyectos de transformación digital de nuestros clientes de manera ágil y segura. ¡Reinventa el futuro con Canvia! Si sientes pasión por la tecnología y quieres transformar negocios, esta es tu oportunidad para desarrollarte en una empresa inclusiva, diversa, que se desafía constantemente. Nuestro propósito es hacer más fácil la vida de las personas, innovando e implementando proyectos de transformación digital con un metodología ágil y segura. Como Analista Programador ANGULAR tendrás la misión de: Desarrollar la interfaz de usuario en Angular con Microfrontends. Integrar con Azu",Lima,Híbrido
Analista programador,"Nos encontramos en la búsqueda de un: Analista Programador Bachiller en ingenieria de sistemas o afines Experiencia mayor a 4 años como programador Experiencia manejando Java, JavaScript, NestJs Experiencia trabajando en entornos agiles Deseble conocimiento en desarrollo de aplicaciones moviles Beneficios: Desarrollo profesional pertenecer a una empresa solida",Lima,Híbrido
Backend Developer Senior - CULQI,"¡Nos encontramos en búsqueda de un BACKEND DEVELOPER SENIOR para el equipo Culqi! Culqi es una fintech líder que pertenece al grupo Credicorp, que está revolucionando los pagos digitales en Latinoamérica con soluciones tecnológicas innovadoras y seguras. Misión del puesto: El Developer Backend Senior es responsable de desarrollar y optimizar soluciones escalables y seguras en Node.js, aprovechando AWS y arquitecturas orientadas a eventos para garantizar sistemas eficientes y resilientes. Su misión es construir y mantener servicios robustos, gestionar la comunicación asincrónica mediante eventos, implementar buenas prácticas de seguridad y optimización. ¿Qué esperamos de ti? Desarrollo y mantenimiento de las aplicaciones integradas a bases de datos SQL y no SQL, Desarrolar APIs REST eficien",San Isidro,Híbrido
Analista programador,"La Universidad de San Martin de Porres te invita a participar en la selección de un analista programador: Requisitos: Titulado o Bachiller de la carrera profesional de Ingeniería de Computación y Sistemas. Office nivel avanzado. Programas requeridos: Asp .NET PHP Wordpress SQL Server SCRUM y/o otros lenguajes de programación Funciones Específicas: Analizar, diseñar, desarrollar e implementar sistemas de información según las necesidades del Centro. Desarrollar aplicaciones web. Determinar la factibilidad técnica de los requerimientos de los usuarios y las propuestas de implementación de los sistemas de información. Elaborar y actualizar los manuales técnicos y de usuario de los sistemas de información asignados. Registrar en el sistema el avance las labores asignadas por su jefe inmediato.",Jesús María,Presencial
Analista Programador (Java Oracle)- Presencial,"Somos una empresa de Soluciones Digitales y Servicios de TI con 30 años de experiencia en el mercado. Contamos con más de 8 mil colaboradores en Latinoamérica, Estados Unidos y Europa. Te invitamos a ser parte de nuestro equipo ocupando el cargo de: Analista Programador Requisitos: Bachiller o Técnico titulado afines con la informática (Ciencias de la Computación, Sistemas de Información, Ingeniería, entre otros). Experiencia y formación en desarrollo de software, por ejemplo, C#, C++, Java, .NET, Pyton, PL/SQL Conocimiento técnico en herramientas de automatización (ejemplo, Blue Prism y UiPath) Conocimientos básicos de programación en HTML, JavaScript. Deseables: Conocimiento en CLOUD Computing Conocimientos de IA y aprendizaje automático Certificación Ágil, PMP u otros Beneficios: Perten",La Victoria,Presencial
Soporte Jr de Aplicaciones (Linux/PLSQL),"Somos una empresa de Soluciones Digitales y Servicios de TI con 30 años de experiencia en el mercado. Contamos con más de 8 mil colaboradores en Latinoamérica, Estados Unidos y Europa. Te invitamos a ser parte de nuestro equipo ocupando el cargo de: Analista de Soporte de Aplicaciones Requisitos indispensables: Profesionales de Ingeniería de Sistemas, Informática, o carreras afines. Conocimiento en programación PL SQL Oracle, .NET, Java, Shell scripts, unix/ linux MS Office básico Experiencia: Más de 1 año de experiencia en desarrollo e implementación de aplicaciones Atención en helpdesk Sector de telecomunicaciones, banca / empresa de servicios masivos Beneficios: Pertenecer al grupo América Móvil. Sueldo en planilla 100% desde el primer día. EPS corporativa (opcional). Convenios corporat",La Victoria,Presencial
ANALISTA PROGRAMADOR JAVA,"En Valtx, empresa con 24 años de experiencia en el mercado peruano, cuyo objetivo principal es convertirse en un socio estratégico, mediante soluciones tecnológicas en los diversos aspectos de los procesos de negocios; el desarrollo, implementación y mantenimiento de aplicaciones e infraestructura tecnológica para el negocio; y consultoría en diversos procesos de transformación, nos encontramos en la búsqueda de un ANALISTA PROGRAMADOR JAVA Principales funciones o actividades - Diseñar y desarrollar aplicaciones en JAVA. - Ejecutar pruebas de software. - Relevar requerimientos. - Brindar soporte a las pruebas con usuarios. - Realizar documentación. - Brindar soporte al despliegue en entornos productivos y no productivos. - Desarrollo de apis REST ¿Qué requisitos necesito? - Técnico, Egresa",San Borja,Híbrido
Analista Programador Postgre/Oracle/Híbrido,"Por encargo de nuestro cliente, importante empresa líder en finanzas, nos encontramos encuentra en búsqueda de: (1) Analista Programador Postgre/Oracle Requisitos Universitario de Ingeniería de Sistemas, Informática, o afines Experiencia de 3 años en puestos similares como mínimo Experiencia realizando labores de Analista de Sistemas Desarrollador Oracle (PL/SQL) nivel avanzado, store procedures, funciones, packages Desarrollador BD PostgreSQL nivel avanzado Experiencia realizando tuning de Base de Datos Conocimiento en Oracle Data Integrator (ODI) Experiencia en GCP, Cloud Composer, Cloud Storage, Cloud Functions, Data Funciton, Data low Modelamiento de Base de Datos Recomendable que haya realizado labores como Analista Fullstack Funciones: Diseñar, analizar y desarrollar soluciones en la",San Borja,Híbrido
Frontend Developer - Angular,"En Experis Perú buscamos al mejor talento para sumarse a los desafíos de la era digital y llevar su carrera a un siguiente nivel. Por ello, te invitamos a que formes parte del reto como FRONTEND DEVELOPER en el rubro Farmacéutico: FRONTEND DEVELOPER Requisitos para postular al cargo: Profesional de las carreras de Ingeniería de sistemas, informática o afines. Experiencia mayor a 4 años en Angular 13+ Experiencia en Estructura Documento HTML (DOM), Integración de pasarelas de pago. Experiencia en Desarrollo Responsive & Mobile-First. Manejo de Arquitectura Modular / Web Components Funciones principales del puesto: Construir la parte visual y funcional de una aplicación web con la que los usuarios interactúan directamente, utilizando el framework Angular junto con HTML, CSS y TypeScript. Div",Lima,Remoto
Desarrollador Frontend Senior- REMOTO,"Ofrece soluciones de negocios en las líneas de Outsourcing, Licenciamientos SAP y Microsoft, soporte y mejora de aplicaciones, así como implementación y migración de sistemas bajo estrategias Cloud, aprovechando su alianza con marcas como Amazon, Azure, Huawei Cloud y Google Cloud. Nos encontramos en la búsqueda de ""Desarrollador Frontend Web Senior"" Requisitos: Mínimo 5 años de experiencia en Desarrollador front end. Experiencia sólida en React. Conocimiento avanzado de JavaScript, HTML5, CSS3 y frameworks asociados. Sólidos conocimientos de HTML5 y CSS3 así como tecnologías afines. Conocimientos de uso y consumo de API REST. Familiaridad con Git y sus plataformas (Gitlab, Github, etc.). Experiencia en Figma. Experiencia en Pruebas, y testing (Jest) Disponibilidad inmediata. Condiciones: ",Lima,Presencial
Desarrollador Backend Java,"Actualmente nos encontramos en búsqueda de 03 Desarrolladores Backend Java para que se integren a nuestro equipo. Requisitos Profesional en Ingeniería de Sistemas, Computación, Informática o carreras afines. Experiencia mínima de 3 años en desarrollo con entorno Java Experiencia desarrollo de aplicaciones backend con Java 8, 11 o 17. Conocimientos sólidos en Spring Boot y otros frameworks del ecosistema Spring. Experiencia en diseño y desarrollo de microservicios aplicando principios de arquitectura limpia. Dominio de programación funcional y reactiva (WebFlux, RxJava). Conocimiento en pruebas unitarias con JUnit y Mockito, así como en metodologías BDD. Familiaridad con prácticas de desarrollo seguro (OWASP, OAuth2). Experiencia en bases de datos relacionales (SQL Server, Azure SQL) y no r",La Molina,Híbrido
Desarrollador Fullstack SemiSenior(Java/Angular),"CSTI Corp es una empresa peruana líder en la industria TI con más de 17 años en el mercado en países como Perú, Ecuador, Colombia, Costa Rica y Estados Unidos. Ofrecemos soluciones de negocios en las líneas de Outsourcing, Licenciamientos SAP y Microsoft, soporte y mejora de aplicaciones, así como implementación y migración de sistemas bajo estrategias Cloud, aprovechando su alianza con marcas como Amazon, Azure, Huawei Cloud y Google Cloud. Nos encontramos en la búsqueda de un ""Fullstack Semi Senior”, para nuestra línea de negocio. 📌Requisitos: Experiencia mínima de 3 años en desarrollo de aplicaciones, plataformas o servicios en la capa frontend como en la capa backend. Experiencia en desarrollo de parte de Frontend con Angular. Experiencia en desarrollo de parte de Backend con Java y Sp",Lima,Presencial
